{
  "id": "k2-horizon-mova-36b-a4b",
  "name": "K2-Horizon-MoVA-36B-A4B",
  "family": "open-llm",
  "developer": "IFM",
  "summary": "IFM built K2-Horizon-MoVA-36B-A4B, a 37.4B-parameter text-generation model. It is a sparse Mixture-of-Experts model designed to handle tasks such as reasoning and agentic tool use.",
  "summary_source": "ai",
  "card_hash": "6addb6eec34b",
  "cells": [
    {
      "input": "text",
      "output": "text"
    }
  ],
  "hf_task": "text-generation",
  "tiers": [
    "datacenter"
  ],
  "license": "apache-2.0",
  "open_weights": true,
  "hf_repo": "IFM/K2-Horizon-MoVA-36B-A4B",
  "links": [
    {
      "label": "IFM/K2-Horizon-MoVA-36B-A4B on Hugging Face",
      "url": "https://huggingface.co/IFM/K2-Horizon-MoVA-36B-A4B"
    }
  ],
  "feeds_into": [],
  "verified": false,
  "notes": "Auto-proposed by the weekly discovery job; unreviewed. Tier estimated from 74.9 GB of weight files (largest checkpoint if several).",
  "source": "auto",
  "metrics": {
    "downloads_30d": 17339,
    "likes": 414,
    "created_at": "2026-09-01T23:01:25.000Z",
    "fetched_at": "2026-10-13T02:08:18.673Z"
  }
}
