{
  "id": "qwen-image-2-1",
  "name": "Qwen-Image-2.1",
  "family": "diffusion",
  "developer": "Qwen",
  "summary": "Built by Qwen, Qwen-Image-2.1 generates images from text and can also edit images. It exists to support image creation and editing, including transparent images and localized changes.",
  "summary_source": "ai",
  "card_hash": "f66eb4114b72",
  "cells": [
    {
      "input": "text",
      "output": "image"
    },
    {
      "input": "image",
      "output": "image"
    }
  ],
  "hf_task": "text-to-image",
  "tiers": [
    "gpu_24gb"
  ],
  "license": null,
  "open_weights": true,
  "hf_repo": "Qwen/Qwen-Image-2.1",
  "links": [
    {
      "label": "Qwen/Qwen-Image-2.1 on Hugging Face",
      "url": "https://huggingface.co/Qwen/Qwen-Image-2.1"
    }
  ],
  "feeds_into": [],
  "verified": false,
  "notes": "Auto-proposed by the weekly discovery job; unreviewed. Tier estimated from 14.2 GB of weights (parameters x 2 bytes).",
  "source": "auto",
  "metrics": {
    "downloads_30d": 142375,
    "likes": 3254,
    "created_at": "2026-09-14T03:47:26.000Z",
    "fetched_at": "2026-10-12T18:47:44.951Z"
  }
}
