{
  "id": "deepseek-v4-1-flash",
  "name": "DeepSeek-V4.1-Flash",
  "family": "open-llm",
  "developer": "deepseek-ai",
  "summary": "Built by deepseek-ai, DeepSeek-V4.1-Flash processes images and text and generates text. Its compressed key-value cache is designed to reduce memory use and costs for long-context, input-heavy tasks.",
  "summary_source": "ai",
  "card_hash": "b167647a19eb",
  "cells": [
    {
      "input": "image",
      "output": "text"
    },
    {
      "input": "text",
      "output": "text"
    }
  ],
  "hf_task": "image-text-to-text",
  "tiers": [
    "datacenter"
  ],
  "license": "mit",
  "open_weights": true,
  "hf_repo": "deepseek-ai/DeepSeek-V4.1-Flash",
  "links": [
    {
      "label": "deepseek-ai/DeepSeek-V4.1-Flash on Hugging Face",
      "url": "https://huggingface.co/deepseek-ai/DeepSeek-V4.1-Flash"
    }
  ],
  "feeds_into": [],
  "verified": false,
  "notes": "Auto-proposed by the weekly discovery job; unreviewed. Tier estimated from 510.3 GB of weight files (largest checkpoint if several).",
  "source": "auto",
  "metrics": {
    "downloads_30d": 1367081,
    "likes": 4655,
    "created_at": "2026-09-10T02:17:58.000Z",
    "fetched_at": "2026-10-19T16:19:55.469Z"
  }
}
