{
  "id": "whisper",
  "name": "Whisper large-v3",
  "family": "whisper",
  "developer": "openai",
  "summary": null,
  "summary_source": null,
  "card_hash": null,
  "links": [
    {
      "label": "openai/whisper-large-v3 on Hugging Face",
      "url": "https://huggingface.co/openai/whisper-large-v3"
    }
  ],
  "feeds_into": [
    "qwen3-8b",
    "closed-llm"
  ],
  "verified": false,
  "notes": "Tier estimated; large-v3 is 1.5B parameters, smaller sizes run on CPU.",
  "source": "curated",
  "metrics": {
    "downloads_30d": 3791795,
    "likes": 6589,
    "fetched_at": "2026-10-11T05:07:36.156Z"
  },
  "cells": [
    {
      "input": "audio",
      "output": "text"
    }
  ],
  "hf_task": "automatic-speech-recognition",
  "tiers": [
    "cpu_edge",
    "gpu_8gb"
  ],
  "license": "apache-2.0",
  "open_weights": true,
  "hf_repo": "openai/whisper-large-v3"
}
