{
  "id": "granite-embedding-311m-multilingual-r2",
  "name": "granite-embedding-311m-multilingual-r2",
  "family": "granite-embedding",
  "developer": "ibm-granite",
  "summary": "IBM’s Granite team built this 312M-parameter model to turn multilingual text into numerical vectors for feature extraction. It supports finding relevant text across languages, including in long documents and code.",
  "summary_source": "ai",
  "card_hash": "0a919c36ac05",
  "cells": [
    {
      "input": "text",
      "output": "embedding"
    }
  ],
  "hf_task": "feature-extraction",
  "tiers": [
    "cpu_edge"
  ],
  "license": "apache-2.0",
  "open_weights": true,
  "hf_repo": "ibm-granite/granite-embedding-311m-multilingual-r2",
  "links": [
    {
      "label": "ibm-granite/granite-embedding-311m-multilingual-r2 on Hugging Face",
      "url": "https://huggingface.co/ibm-granite/granite-embedding-311m-multilingual-r2"
    }
  ],
  "feeds_into": [],
  "verified": false,
  "notes": "Auto-proposed by the weekly discovery job; unreviewed. Tier estimated from 312M parameters.",
  "source": "auto",
  "metrics": {
    "downloads_30d": 161103,
    "likes": 143,
    "fetched_at": "2026-10-11T05:48:06.034Z"
  }
}
