{
  "id": "gpt-6-1-sol",
  "name": "GPT-6.1 Sol",
  "family": "closed-llm",
  "developer": "OpenAI",
  "summary": "Built by OpenAI, GPT-6.1 Sol is a hosted language model suited for agentic coding, computer use, and document-heavy professional tasks.",
  "summary_source": "ai",
  "card_hash": "63e20806c051",
  "cells": [
    {
      "input": "image",
      "output": "text"
    },
    {
      "input": "text",
      "output": "text"
    }
  ],
  "hf_task": null,
  "tiers": [
    "api"
  ],
  "license": null,
  "open_weights": false,
  "hf_repo": null,
  "links": [
    {
      "label": "OpenRouter model page",
      "url": "https://openrouter.ai/openai/gpt-6.1-sol"
    }
  ],
  "feeds_into": [],
  "verified": false,
  "notes": "Auto-proposed by the weekly discovery job from OpenRouter's catalogue; unreviewed. Proprietary: license unknown, weights not public.",
  "source": "auto",
  "metrics": null
}
