{
  "id": "gpt-6-1-sol-pro",
  "name": "GPT-6.1 Sol Pro",
  "family": "closed-llm",
  "developer": "OpenAI",
  "summary": "OpenAI developed GPT-6.1 Sol Pro, a hosted language model configured to provide higher-quality responses to complex tasks.",
  "summary_source": "ai",
  "card_hash": "9672dc23e234",
  "cells": [
    {
      "input": "image",
      "output": "text"
    },
    {
      "input": "text",
      "output": "text"
    }
  ],
  "hf_task": null,
  "tiers": [
    "api"
  ],
  "license": null,
  "open_weights": false,
  "hf_repo": null,
  "links": [
    {
      "label": "OpenRouter model page",
      "url": "https://openrouter.ai/openai/gpt-6.1-sol-pro"
    }
  ],
  "feeds_into": [],
  "verified": false,
  "notes": "Auto-proposed by the weekly discovery job from OpenRouter's catalogue; unreviewed. Proprietary: license unknown, weights not public.",
  "source": "auto",
  "metrics": null
}
