{
  "id": "ember-1",
  "name": "Ember-1",
  "family": "closed-llm",
  "developer": "Fireworks",
  "summary": "Fireworks built Ember-1 as a reasoning language model that produces shorter reasoning traces to use tokens more efficiently.",
  "summary_source": "ai",
  "card_hash": "34d2b5078310",
  "cells": [
    {
      "input": "text",
      "output": "text"
    },
    {
      "input": "image",
      "output": "text"
    }
  ],
  "hf_task": null,
  "tiers": [
    "api"
  ],
  "license": null,
  "open_weights": false,
  "hf_repo": null,
  "links": [
    {
      "label": "OpenRouter model page",
      "url": "https://openrouter.ai/fireworks/ember-1"
    }
  ],
  "feeds_into": [],
  "verified": false,
  "notes": "Auto-proposed by the weekly discovery job from OpenRouter's catalogue; unreviewed. Proprietary: license unknown, weights not public.",
  "source": "auto",
  "metrics": null
}
