{
  "id": "tf-efficientnetv2-s-in21k-ft-in1k",
  "name": "tf_efficientnetv2_s.in21k_ft_in1k",
  "family": "efficientnetv2",
  "developer": "timm",
  "summary": "Built by the EfficientNetV2 paper authors in TensorFlow and ported to PyTorch by Ross Wightman, this 22M-parameter model classifies images. It was trained on ImageNet-21k and fine-tuned on ImageNet-1k.",
  "summary_source": "ai",
  "card_hash": "99dcb1270da9",
  "cells": [
    {
      "input": "image",
      "output": "label"
    },
    {
      "input": "image",
      "output": "embedding"
    }
  ],
  "hf_task": "image-classification",
  "tiers": [
    "cpu_edge"
  ],
  "license": "apache-2.0",
  "open_weights": true,
  "hf_repo": "timm/tf_efficientnetv2_s.in21k_ft_in1k",
  "links": [
    {
      "label": "timm/tf_efficientnetv2_s.in21k_ft_in1k on Hugging Face",
      "url": "https://huggingface.co/timm/tf_efficientnetv2_s.in21k_ft_in1k"
    }
  ],
  "feeds_into": [],
  "verified": false,
  "notes": "Auto-proposed by the weekly discovery job; unreviewed. Tier estimated from 87 MB of weight files (largest checkpoint if several).",
  "source": "auto",
  "metrics": {
    "downloads_30d": 1724633,
    "likes": 13,
    "created_at": "2022-12-13T00:19:21.000Z",
    "fetched_at": "2026-10-19T16:19:55.469Z"
  }
}
