{
  "id": "claude-opus-5-5",
  "name": "Claude Opus 5.5",
  "family": "closed-llm",
  "developer": "Anthropic",
  "summary": "Anthropic built Claude Opus 5.5, a hosted language model for reasoning, coding, and agentic tasks. It is intended to handle demanding multi-step work, including changes across large codebases.",
  "summary_source": "ai",
  "card_hash": "9712d10b38d0",
  "cells": [
    {
      "input": "text",
      "output": "text"
    },
    {
      "input": "image",
      "output": "text"
    }
  ],
  "hf_task": null,
  "tiers": [
    "api"
  ],
  "license": null,
  "open_weights": false,
  "hf_repo": null,
  "links": [
    {
      "label": "OpenRouter model page",
      "url": "https://openrouter.ai/anthropic/claude-opus-5.5"
    }
  ],
  "feeds_into": [],
  "verified": false,
  "notes": "Auto-proposed by the weekly discovery job from OpenRouter's catalogue; unreviewed. Proprietary: license unknown, weights not public.",
  "source": "auto",
  "metrics": null
}
