{
  "id": "sam3",
  "name": "SAM 3",
  "family": "sam",
  "developer": "facebook",
  "summary": null,
  "summary_source": null,
  "card_hash": null,
  "feeds_into": [],
  "verified": false,
  "notes": "License is listed as 'other' on the Hub; read the repo's license text before filling this in. ~860M parameters.",
  "source": "curated",
  "metrics": {
    "downloads_30d": 2128836,
    "likes": 4015,
    "fetched_at": "2026-10-11T05:48:06.034Z",
    "created_at": "2025-11-07T05:17:48.000Z"
  },
  "cells": [
    {
      "input": "image",
      "output": "boxes_masks"
    },
    {
      "input": "video",
      "output": "boxes_masks"
    }
  ],
  "hf_task": "mask-generation",
  "tiers": [
    "gpu_8gb"
  ],
  "license": null,
  "open_weights": true,
  "hf_repo": "facebook/sam3",
  "links": [
    {
      "label": "facebook/sam3 on Hugging Face",
      "url": "https://huggingface.co/facebook/sam3"
    }
  ]
}
